{
  "$schema": "http://json-schema.org/draft-07/schema#",
  "type": "object",
  "properties": {
    "title": { "type": "string" },
    "coupon_container_title": { "type": "string" },
    "server_dropdown_label": { "type": "string" },
    "server_dropdown_placeholder": { "type": "string" },
    "account_name_label": { "type": "string" },
    "account_name_placeholder": { "type": "string" },
    "coupon_code_label": { "type": "string" },
    "coupon_code_placeholder": { "type": "string" },
    "redeem_button": { "type": "string" },
    "modal_title": { "type": "string" },
    "success": { "type": "string" },
    "failure": { "type": "string" },
    "pending": { "type": "string" },
    "networkError": { "type": "string" },
    "invalidServerName": { "type": "string" },
    "invalidAccountName": { "type": "string" },
    "invalidCouponCode": { "type": "string" },
    "INVALID_REQUEST": { "type": "string" },
    "INVALID_ACCOUNT": { "type": "string" },
    "INVALID_COUPON": { "type": "string" },
    "NO_ACCOUNT": { "type": "string" },
    "BLOCKED_ACCOUNT": { "type": "string" },
    "EXPIRED_COUPON": { "type": "string" },
    "USED_COUPON": { "type": "string" },
    "SYSTEM_ERROR": { "type": "string" }
  },
  "required": [
    "title",
    "coupon_container_title",
    "server_dropdown_label",
    "server_dropdown_placeholder",
    "account_name_label",
    "account_name_placeholder",
    "coupon_code_label",
    "coupon_code_placeholder",
    "redeem_button",
    "modal_title",
    "success",
    "failure",
    "pending",
    "networkError",
    "invalidServerName",
    "invalidAccountName",
    "invalidCouponCode",
    "INVALID_REQUEST",
    "INVALID_ACCOUNT",
    "INVALID_COUPON",
    "NO_ACCOUNT",
    "BLOCKED_ACCOUNT",
    "EXPIRED_COUPON",
    "USED_COUPON",
    "SYSTEM_ERROR"
  ],
  "additionalProperties": false
}