{
  "title": "Coupon Page",
  "coupon_container_title": "Redeem Coupon",
  "server_dropdown_label": "Select Server",
  "server_dropdown_placeholder": "-- Select a Server --",
  "account_name_label": "Recovery Email",
  "account_name_placeholder": "Enter recovery email",
  "coupon_code_label": "Coupon Code",
  "coupon_code_placeholder": "Enter coupon code",
  "redeem_button": "Redeem",
  "modal_title": "Coupon Redemption Result",
  "success": "Coupon redeemed successfully.",
  "failure": "Coupon redemption failed.",
  "pending": "Processing...",
  "networkError": "A network error occurred.\nPlease try again shortly.",
  "invalidServerName": "Invalid server name.\nPlease select from the server list.",
  "invalidAccountName": "Invalid email format.\nPlease enter a valid recovery email.",
  "invalidCouponCode": "Invalid coupon code.\nIt must consist of 8 to 12 uppercase letters and numbers.",
  "INVALID_REQUEST": "Invalid request.",
  "INVALID_ACCOUNT": "Invalid account.\nPlease check the server.",
  "INVALID_COUPON": "Invalid coupon.\nPlease check the coupon code again.",
  "NO_ACCOUNT": "Account not found.\nPlease recheck the recovery email.",
  "BLOCKED_ACCOUNT": "This account is permanently blocked.\nPlease contact customer service.",
  "EXPIRED_COUPON": "Expired coupon.",
  "USED_COUPON": "This coupon has already been used.",
  "SYSTEM_ERROR": "A system error occurred while processing the task.\nPlease try again shortly."
}